ros_time_sec,event_type,phase,pose_index,total_poses,safety_tag,message
1778779683.433708191,sequence_started,sequence_start,0,10,sequence,Task pose sequence started.
1778779683.535649538,phase_started,safe_home,1,10,nominal_clearance,Raised parked configuration used as the task sequence start.
1778779683.587279558,goal_sent,safe_home,1,10,nominal_clearance,Sent FollowJointTrajectory goal with duration 4.00s.
1778779683.640532494,goal_accepted,safe_home,1,10,nominal_clearance,FollowJointTrajectory goal accepted by controller.
1778779692.644096613,phase_failed,safe_home,1,10,nominal_clearance,Phase failed because the controller did not return a result within 9.00s.
1778779692.690610409,sequence_failed,safe_home,1,10,nominal_clearance,Task sequence failed at pose 'safe_home'.
